{
  "agent": {
    "hostname": "scm-test-agent",
    "role": "developer",
    "checkIntervalMs": 30000,
    "taskRetryCount": 2,
    "validation": {
      "mode": "always",
      "reviewEveryNthItem": 1
    }
  },
  "copilot": {
    "model": "claude-haiku-5.5"
  },
  "mailbox": {
    "repoPath": "../runtime_mailbox",
    "autoCommit": false,
    "supportBroadcast": false,
    "supportAttachments": false
  },
  "manager": {
    "hostname": "localhost",
    "escalationPriority": "LOW"
  },
  "quota": {
    "enabled": false
  }
}
