{
  "agent": {
    "hostname": "smoke-wf-dev",
    "role": "developer",
    "checkIntervalMs": 5000,
    "taskRetryCount": 2,
    "workflowFile": "../../workflow.json",
    "validation": {
      "mode": "none",
      "reviewEveryNthItem": 99
    }
  },
  "copilot": {
    "model": "claude-haiku-5.5"
  },
  "mailbox": {
    "repoPath": "../runtime_mailbox",
    "autoCommit": false,
    "supportBroadcast": false,
    "supportAttachments": false
  },
  "manager": {
    "hostname": "smoke-wf-mgr"
  },
  "quota": {
    "enabled": false
  }
}
