{
  "agent": {
    "hostname": "converter-wf-dev",
    "role": "developer",
    "checkIntervalMs": 10000,
    "taskRetryCount": 2,
    "minWorkItems": 1,
    "maxWorkItems": 3,
    "workflowFile": "../workflow.json",
    "validation": {
      "mode": "none",
      "reviewEveryNthItem": 99
    }
  },
  "copilot": {
    "model": "claude-haiku-5.5"
  },
  "mailbox": {
    "repoPath": "../runtime_mailbox",
    "autoCommit": false,
    "supportBroadcast": false,
    "supportAttachments": false
  },
  "manager": null,
  "teamMembers": [
    {
      "hostname": "converter-wf-dev",
      "role": "developer",
      "responsibilities": "Build the converter module through the workflow states (self-loop routing)."
    }
  ],
  "quota": {
    "enabled": false
  }
}
