{
  "agent": {
    "hostname": "smoke-wip-mgr",
    "role": "manager",
    "checkIntervalMs": 5000,
    "stuckTimeoutMs": 120000,
    "taskRetryCount": 2,
    "workflowFile": "../../workflow.json",
    "wipLimit": 2,
    "validation": {
      "mode": "none",
      "reviewEveryNthItem": 99
    }
  },
  "copilot": {
    "model": "claude-haiku-5.5"
  },
  "mailbox": {
    "repoPath": "../runtime_mailbox",
    "autoCommit": false,
    "supportBroadcast": false,
    "supportAttachments": false
  },
  "manager": {
    "hostname": "smoke-wip-mgr",
    "escalationPriority": "NORMAL"
  },
  "teamMembers": [
    {
      "hostname": "smoke-wip-dev",
      "role": "developer",
      "responsibilities": "Implementation tasks for WIP smoke test"
    },
    {
      "hostname": "smoke-wip-qa",
      "role": "qa",
      "responsibilities": "Validation tasks for WIP smoke test"
    }
  ],
  "quota": {
    "enabled": false
  }
}
